rid,name,img,city,area,location,description,amenities,rating
24,Hotel Shree Murli,hotel/6s.jpg,Shegaon,Anand Sagar Gate,https://www.google.com/maps/embed?pb=!1m18!1m12!1m3!1d29841.86166988556!2d76.66868477238452!3d20.7818713715819!2m3!1f0!2f0!3f0!3m2!1i1024!2i768!4f13.1!3m3!1m2!1s0x3bd7458f77c0c773%3A0x1f7b073618659da0!2sHOTEL%20SHREE%20MURLI!5e0!3m2!1sen!2sin!4v1709831796548!5m2!1sen!2sin,"Hotel Shree Murli Shegaon is a charming retreat nestled in the heart of Shegaon, offering comfortable accommodations and warm hospitality. The hotel's well-appointed rooms provide a cozy ambiance for guests to relax and unwind. Indulge in delicious cuisine served at the on-site restaurant, showcasing a variety of local and international flavors. With attentive service and modern amenities, including a 24-hour front desk and free Wi-Fi, Hotel Shree Murli ensures a convenient and enjoyable stay for both leisure and business travelers. Its prime location near popular attractions such as the Anand Sagar and Gajanan Maharaj Temple adds to the allure of this welcoming establishment.","""{\""ac\"": false, \""tv\"": false, \""bar\"": false, \""spa\"": false, \""wifi\"": true, \""laundry\"": false, \""parking\"": false, \""restaurant\"": false, \""pet_friendly\"": false, \""room_service\"": false, \""swimming_pool\"": false, \""fitness_center\"": false}""",4.7
23,Hotel Yogiraj Palace,hotel/5s.jpg,Shegaon,Payur Wadegaon,https://www.google.com/maps/embed?pb=!1m18!1m12!1m3!1d3730.4872430580704!2d76.69871100000003!3d20.771566999999994!2m3!1f0!2f0!3f0!3m2!1i1024!2i768!4f13.1!3m3!1m2!1s0x3bd745857f59a5c9%3A0x5f2d319a5e8dac1f!2sHotel%20Yogiraj!5e0!3m2!1sen!2sin!4v1709831244006!5m2!1sen!2sin,"Hotel Yogiraj Palace Shegaon is a haven of comfort and tranquility situated in the heart of Shegaon. Boasting spacious and elegantly designed rooms, the hotel offers a serene retreat for guests seeking relaxation. Indulge in delicious cuisine at the in-house restaurant or unwind with a refreshing drink at the cozy bar. With attentive staff and modern amenities, including a fitness center and conference facilities, Hotel Yogiraj Palace caters to both leisure and business travelers. Its proximity to the renowned Anand Sagar and Shegaon Railway Station makes it an ideal choice for a memorable stay in Shegaon.","{""ac"": false, ""tv"": false, ""bar"": false, ""spa"": false, ""wifi"": false, ""laundry"": false, ""parking"": false, ""restaurant"": false, ""pet_friendly"": false, ""room_service"": false, ""swimming_pool"": false, ""fitness_center"": false}",3.5
22,Vighnaharta Inn Hotel,hotel/4S.jpg,Shegaon,SBI Colony,https://www.google.com/maps/embed?pb=!1m18!1m12!1m3!1d14921.412612741158!2d76.66666436977536!3d20.776995999999997!2m3!1f0!2f0!3f0!3m2!1i1024!2i768!4f13.1!3m3!1m2!1s0x3bd745d5090f2f25%3A0x7ce6d6dae90c177c!2sVighnaharta%20Inn!5e0!3m2!1sen!2sin!4v1709830836464!5m2!1sen!2sin,"Vighnaharta Inn Hotel Shegaon welcomes guests with warm hospitality and modern comforts in the charming town of Shegaon. Nestled amidst tranquil surroundings, the hotel offers well-appointed rooms featuring contemporary amenities for a comfortable stay. Guests can relish delicious meals at the on-site restaurant, unwind with a refreshing swim in the pool, or simply relax in the serene ambiance of the hotel's gardens. With its convenient location near the renowned Shegaon Temple and attentive service, Vighnaharta Inn Hotel Shegaon promises a delightful retreat for pilgrims and travelers alike.","{""ac"": false, ""tv"": false, ""bar"": false, ""spa"": false, ""wifi"": false, ""laundry"": false, ""parking"": false, ""restaurant"": false, ""pet_friendly"": false, ""room_service"": false, ""swimming_pool"": false, ""fitness_center"": false}",3.9
21,Hotel Pinnacle,hotel/3s.jpg,Shegaon,Khamgaon Rd,https://www.google.com/maps/embed?pb=!1m18!1m12!1m3!1d3729.8831100851276!2d76.68752310000002!3d20.796016299999994!2m3!1f0!2f0!3f0!3m2!1i1024!2i768!4f13.1!3m3!1m2!1s0x3bd745081d6c9495%3A0x407108b9327b1f1e!2sHotel%20Pinnacle!5e0!3m2!1sen!2sin!4v1709830145622!5m2!1sen!2sin,"Hotel Pinnacle epitomizes sophistication and comfort in the heart of the city. Featuring spacious and elegantly appointed rooms, each offering stunning views of the skyline or the serene surroundings. Guests can savor exquisite dining experiences at the hotel's restaurant, relax by the poolside with a refreshing drink, or pamper themselves with a range of wellness treatments at the spa. With impeccable service and a prime location near major attractions, Hotel Pinnacle ensures a memorable stay for discerning travelers seeking luxury and convenience.","{""ac"": true, ""tv"": true, ""bar"": false, ""spa"": true, ""wifi"": true, ""laundry"": false, ""parking"": true, ""restaurant"": true, ""pet_friendly"": false, ""room_service"": false, ""swimming_pool"": false, ""fitness_center"": false}",4.0
20,Hotel Sharanam Shegaon,hotel/2s.jpg,Shegaon,Ganapati Nagar,https://www.google.com/maps/embed?pb=!1m18!1m12!1m3!1d29839.68106517496!2d76.66208923955078!3d20.792900700000008!2m3!1f0!2f0!3f0!3m2!1i1024!2i768!4f13.1!3m3!1m2!1s0x3bd745102abe9581%3A0x49955c39ff403bb2!2sHotel%20Sharanam%20Shegaon!5e0!3m2!1sen!2sin!4v1709823507693!5m2!1sen!2sin,"Located in Shegaon, 46 km from Akola Junction, Hotel Sharanam provides accommodation with a garden, free private parking, a terrace and a restaurant. The accommodation features room service, and luggage storage for guests.

The hotel will provide guests with air-conditioned rooms offering a desk, a safety deposit box, a flat-screen TV, a balcony and a private bathroom with a shower. At Hotel Sharanam each room has bed linen and towels.","{""ac"": false, ""tv"": false, ""bar"": false, ""spa"": false, ""wifi"": false, ""laundry"": false, ""parking"": false, ""restaurant"": false, ""pet_friendly"": false, ""room_service"": false, ""swimming_pool"": false, ""fitness_center"": false}",4.0
19,Hotel Grand Sun,hotel/1S.jpeg,Shegaon,"Front of Anand Sagar Main Gate, Balapur Road",https://www.google.com/maps/embed?pb=!1m18!1m12!1m3!1d29841.351662553618!2d76.68511579999999!3d20.78445145!2m3!1f0!2f0!3f0!3m2!1i1024!2i768!4f13.1!3m3!1m2!1s0x3bd7458f9903427b%3A0x406a194ce54391d0!2sHOTEL%20GRAND%20SUN!5e0!3m2!1sen!2sin!4v1709823326187!5m2!1sen!2sin,"HOTEL GRAND SUN is a great choice for travellers looking for a star hotel in Shegaon. This Hotel stands out as one of the highly recommended hotel in Shegaon. Hotel is rated 4.5 out of 5, which is considered as very good.

From all the Budget hotels in Shegaon, HOTEL GRAND SUN is very much popular among the tourists. A smooth check-in/check-out process, flexible policies and friendly management garner great customer satisfaction for this property. The Hotel has standard Check-In time as 02:00 PM and Check-Out time as 12:00 PM. It is a couple-friendly property, hence it is absolutely safe for unmarried couples to stay here.","{""ac"": false, ""tv"": false, ""bar"": false, ""spa"": false, ""wifi"": false, ""laundry"": false, ""parking"": false, ""restaurant"": false, ""pet_friendly"": false, ""room_service"": false, ""swimming_pool"": false, ""fitness_center"": false}",4.3
18,The Byke Heritage Resort Matheran,hotel/6M.jpg,Matheran,MG Road,https://www.google.com/maps/embed?pb=!1m14!1m8!1m3!1d3772.8437696189053!2d73.267247!3d18.9825059!3m2!1i1024!2i768!4f13.1!3m3!1m2!1s0x3be7e5164a4a7ed1%3A0x904917af3e14ff5!2sThe%20Byke%20Heritage%20Resort%20Matheran!5e0!3m2!1sen!2sin!4v1709823083074!5m2!1sen!2sin,"The Byke Heritage Matheran features a garden, terrace, a restaurant and bar in Matheran. This 3-star hotel offers room service and a 24-hour front desk. The accommodation offers evening entertainment and a tour desk.

Complete with a private bathroom equipped with a shower and free toiletries, the units at the hotel have a flat-screen TV and air conditioning, and certain rooms will provide you with a seating area. At The Byke Heritage Matheran every room includes bed linen and towels.

The nearest airport is Chhatrapati Shivaji International Mumbai Airport, 68 km from the accommodation.","{""ac"": false, ""tv"": false, ""bar"": false, ""spa"": false, ""wifi"": false, ""laundry"": false, ""parking"": false, ""restaurant"": false, ""pet_friendly"": false, ""room_service"": false, ""swimming_pool"": false, ""fitness_center"": false}",4.4
17,The Redwood Resort Matheran,hotel/5m.jpg,Matheran,"M.G Road, Opp. Police Station",https://www.google.com/maps/embed?pb=!1m18!1m12!1m3!1d3772.8437704251483!2d73.26724699978423!3d18.98250586440583!2m3!1f0!2f0!3f0!3m2!1i1024!2i768!4f13.1!3m3!1m2!1s0x3be7e55638f45b9f%3A0xe6a6b927918282c5!2sThe%20Redwood%20Resort%20Matheran!5e0!3m2!1sen!2sin!4v1709822898181!5m2!1sen!2sin,"Located in Matheran, 500 m from Charlotte Lake, Redwood Resort Matheran provides accommodation with a garden, private parking and a bar. Among the facilities of this property are a restaurant, a 24-hour front desk and room service, along with free WiFi. The property is non-smoking and is set less than 1 km from Panorama Point. The nearest airport is Chhatrapati Shivaji International Mumbai Airport, 97 km from the hotel. We speak your language!
Select Rooms at Redwood Resort Matheran","{""ac"": false, ""tv"": false, ""bar"": false, ""spa"": false, ""wifi"": false, ""laundry"": false, ""parking"": false, ""restaurant"": false, ""pet_friendly"": false, ""room_service"": false, ""swimming_pool"": false, ""fitness_center"": false}",4.0
16,Hotel Panorama,hotel/4m.jpeg,Matheran,"Kasturba Rd, near Railway Station Bazar & Jain Temple",https://www.google.com/maps/embed?pb=!1m18!1m12!1m3!1d3772.6693002989123!2d73.26957!3d18.9902069!2m3!1f0!2f0!3f0!3m2!1i1024!2i768!4f13.1!3m3!1m2!1s0x3be7effbe6ce336d%3A0xa62e472ae12e7b0b!2sHotel%20Panorama!5e0!3m2!1sen!2sin!4v1709822554524!5m2!1sen!2sin,"Hotel Panorama is just two minutes' walk from Matheran railway station & bazaar, situated in peaceful location surrounded by natural greenery. Our location is ideal for tourist who prefer to stay in clean cottage type rooms with 4 star amenities Our tradition of personalized service and modern amenities will make you surrender to the surroundings.","{""ac"": false, ""tv"": false, ""bar"": false, ""spa"": false, ""wifi"": false, ""laundry"": false, ""parking"": false, ""restaurant"": false, ""pet_friendly"": false, ""room_service"": false, ""swimming_pool"": false, ""fitness_center"": false}",4.4
15,Hotel Premdeep,hotel/3m_Prem.jpg,Matheran,Kasturba Road,https://www.google.com/maps/embed?pb=!1m18!1m12!1m3!1d3772.769484061763!2d73.2694297!3d18.9857852!2m3!1f0!2f0!3f0!3m2!1i1024!2i768!4f13.1!3m3!1m2!1s0x3be7eff8c3eff32d%3A0x5cf553d00f07cdea!2sHotel%20Premdeep!5e0!3m2!1sen!2sin!4v1709822247143!5m2!1sen!2sin,"Premdeep Hotel aims to make your visit as relaxing and enjoyable as possible, which is why so many guests continue to come back year after year.

While staying at Premdeep Hotel, visitors can check out Hart Point (1.5 mi) and One Tree Hill Point (1.6 mi), some of Matheran's top attractions.

You’ll enjoy relaxing rooms that offer a flat screen TV, air conditioning, and a desk, bringing comfort and convenience to your visit.

The small hotel features room service. Plus, Premdeep Hotel offers an on-site restaurant, providing a pleasant respite from your busy day.

If you are looking for a nearby place to eat, Premdeep Hotel is within walking distance of Hotel Panorama Restaurant (0.3 mi), a popular restaurant in the area.

Should time allow, Louisa Point, Porcupine Point (Sunset Point), and Alexander Point are some popular attractions that are within walking distance.

Premdeep Hotel puts the best of Matheran at your fingertips, making your stay both relaxing and enjoyable","{""ac"": false, ""tv"": false, ""bar"": false, ""spa"": false, ""wifi"": false, ""laundry"": false, ""parking"": false, ""restaurant"": false, ""pet_friendly"": false, ""room_service"": false, ""swimming_pool"": false, ""fitness_center"": false}",4.1
14,Hotel Royal,hotel/2m_Royal.jpg,Matheran,Kasturba Road,https://www.google.com/maps/embed?pb=!1m18!1m12!1m3!1d3772.6862699279172!2d73.2691563!3d18.989458!2m3!1f0!2f0!3f0!3m2!1i1024!2i768!4f13.1!3m3!1m2!1s0x3be7ce12e98711a7%3A0x4ad81e1827bb915b!2sRoyal%20Hotel%20Matheran!5e0!3m2!1sen!2sin!4v1709822115899!5m2!1sen!2sin,"Hotel Royal is located in the city of Matheran, It is an amazing destination located in Maharashtra. The lush green beauty with serene environment and amazing ambiance makes it a perfect place to explore the natural beauty. The hotel offers services that are designed to offer maximum comfort to its guests. Some of the services offered here are room service and front desk for the convenience of guests. Every room in the hotel is uniquely designed with cozy interiors and offer exclusive amenities attached bathroom and various other essential bathroom toiletries. Have a pleasent stay at Hotel Royal!","{""ac"": false, ""tv"": false, ""bar"": false, ""spa"": false, ""wifi"": false, ""laundry"": false, ""parking"": false, ""restaurant"": false, ""pet_friendly"": false, ""room_service"": false, ""swimming_pool"": false, ""fitness_center"": false}",3.6
13,Westend Hotel,hotel/1M.jpg,Matheran,Acharya Atre Road Next To Police Station,https://www.google.com/maps/embed?pb=!1m18!1m12!1m3!1d3772.8437696189053!2d73.267247!3d18.982505899999996!2m3!1f0!2f0!3f0!3m2!1i1024!2i768!4f13.1!3m3!1m2!1s0x3be7e556331ca5d5%3A0x235a2639a33a80fa!2sWestend%20Hotel%20Matheran!5e0!3m2!1sen!2sin!4v1709821897788!5m2!1sen!2sin,"Westend Hotel is located in Matheran. With an outdoor swimming pool, the 3-star hotel has air-conditioned rooms with free WiFi, each with a private bathroom. The property has a garden, as well as a restaurant that serves Chinese and Indian cuisine.

All units in the hotel are equipped with a flat-screen TV with satellite channels. All rooms are equipped with a kettle, while selected rooms are fitted with a balcony and others also offer pool views. At Westend Hotel each room includes bed linen and towels.

Languages spoken at the reception include English, Hindi and Marathi.

The nearest airport is Chhatrapati Shivaji International Mumbai Airport, 68 km from the accommodation.","{""ac"": false, ""tv"": false, ""bar"": false, ""spa"": false, ""wifi"": false, ""laundry"": false, ""parking"": false, ""restaurant"": false, ""pet_friendly"": false, ""room_service"": false, ""swimming_pool"": false, ""fitness_center"": false}",4.4
12,Mizzle Exotica Lonavala,hotel/Mizzle_6L.jpg,Lonavala,"adapur Road, Malavali",https://www.google.com/maps/embed?pb=!1m18!1m12!1m3!1d3778.221913379029!2d73.4632812!3d18.743622199999997!2m3!1f0!2f0!3f0!3m2!1i1024!2i768!4f13.1!3m3!1m2!1s0x3be8013f09377ef9%3A0x35e94e04a9f58d1b!2sMizzle%20Exotica!5e0!3m2!1sen!2sin!4v1709821711091!5m2!1sen!2sin,"Situated in Lonavala and only 13 km from Lonavala Railway Station, Mizzle Exotica Lonavala offers accommodation with mountain views, free WiFi and free private parking. There is a private entrance at the apartment for the convenience of those who stay. Boasting family rooms, this property also provides guests with a children's playground.

Featuring a balcony, each unit is air conditioned and features a dining area and a seating area with a cable flat-screen TV. The apartment complex provides some units that have a terrace and pool view, and each unit has a private bathroom and a desk. At the apartment complex, the units are fitted with bed linen and towels.

À la carte and Asian breakfast options with local specialities and cheese are available each morning at the apartment. At Mizzle Exotica Lonavala, the family-friendly restaurant is open for dinner, lunch and high tea and specialises in Indian cuisine.","{""ac"": true, ""tv"": true, ""bar"": false, ""spa"": true, ""wifi"": true, ""laundry"": false, ""parking"": true, ""restaurant"": true, ""pet_friendly"": false, ""room_service"": false, ""swimming_pool"": false, ""fitness_center"": false}",4.2
11,City Palace Resort,hotel/City_Palace_5L.jpg,Lonavala,"Opp Badri Vishal Society, Near HDFC Training Center",https://www.google.com/maps/embed?pb=!1m18!1m12!1m3!1d3777.8469050065564!2d73.41103000000001!3d18.7603742!2m3!1f0!2f0!3f0!3m2!1i1024!2i768!4f13.1!3m3!1m2!1s0x3be801f2aa20aaf3%3A0x93e325b51e785a44!2sCity%20Palace%20Resort!5e0!3m2!1sen!2sin!4v1709821453842!5m2!1sen!2sin,"Situated in Lonavala, within 2.2 km of Lonavala Railway Station and 5.2 km of Kune Falls, City Palace Resort features accommodation with a garden and as well as free private parking for guests who drive. With an outdoor swimming pool, the 2-star hotel has air-conditioned rooms with free WiFi, each with a private bathroom. The accommodation provides room service, a 24-hour front desk and luggage storage for guests.

At the hotel, all rooms include a wardrobe. Rooms have a desk and a flat-screen TV, and some rooms at City Palace Resort have a balcony. At the accommodation rooms come with bed linen and towels.

You can play table tennis at City Palace Resort.

Bhushi Dam is 7.2 km from the hotel, while Lion's Point is 13 km from the property. The nearest airport is Pune International Airport, 70 km from City Palace Resort.","{""ac"": true, ""tv"": true, ""bar"": false, ""spa"": true, ""wifi"": true, ""laundry"": false, ""parking"": true, ""restaurant"": false, ""pet_friendly"": false, ""room_service"": false, ""swimming_pool"": false, ""fitness_center"": true}",4.1
10,Hotel Lonavala,hotel/Hotel_Lonavala.jpg,Lonavala,Old Mumbai Pune Highway,https://www.google.com/maps/embed?pb=!1m18!1m12!1m3!1d30223.846674423054!2d73.40971984999997!3d18.754393100000005!2m3!1f0!2f0!3f0!3m2!1i1024!2i768!4f13.1!3m3!1m2!1s0x3be7c98942055771%3A0xe55752ea1bf2e339!2sHotel%20Lonavala!5e0!3m2!1sen!2sin!4v1709821291929!5m2!1sen!2sin,"Located in Lonavala, 1.3 km from Lonavala Railway Station, Hotel Lonavla provides accommodation with a restaurant, free private parking and a bar. This 3-star hotel offers room service and a 24-hour front desk. The hotel features family rooms.

Guest rooms in the hotel are fitted with a flat-screen TV with satellite channels. With a private bathroom equipped with a shower and free toiletries, rooms at Hotel Lonavla also offer free WiFi, while selected rooms are fitted with a city view. The rooms will provide guests with a fridge.

Kune Falls is 4.4 km from the accommodation, while Bhushi Dam is 6.4 km away. The nearest airport is Pune International Airport, 70 km from Hotel Lonavla.","{""ac"": false, ""tv"": false, ""bar"": false, ""spa"": false, ""wifi"": false, ""laundry"": false, ""parking"": false, ""restaurant"": false, ""pet_friendly"": false, ""room_service"": false, ""swimming_pool"": false, ""fitness_center"": false}",3.6
9,Regenta SGS Greenotel,hotel/Greenotel.jpg,Lonavala,Old Mumbai Pune Highway Opposite LIC Building,https://www.google.com/maps/embed?pb=!1m18!1m12!1m3!1d3777.963299164829!2d73.40846899999998!3d18.75517629999999!2m3!1f0!2f0!3f0!3m2!1i1024!2i768!4f13.1!3m3!1m2!1s0x3be801ec7265c617%3A0xa4d8ed91ef57f8f1!2sRegenta%20SGS%20Greenotel%20-%20Lonavala!5e0!3m2!1sen!2sin!4v1709820565614!5m2!1sen!2sin,"You're eligible for a Genius discount at Regenta SGS Greenotel - Lonavala! To save at this property, all you have to do is sign in.

Situated in Lonavala, 600 metres from Lonavala Railway Station, Regenta SGS Greenotel - Lonavala features accommodation with an outdoor swimming pool, free private parking, a garden and a terrace. Featuring a restaurant, the 4-star hotel has air-conditioned rooms with free WiFi, each with a private bathroom. The accommodation provides room service, a 24-hour front desk and currency exchange for guests.

Rooms are fitted with a flat-screen TV, and some rooms at the hotel have a city view. The rooms will provide guests with a desk and a kettle.

Bike hire and car hire are available at this hotel and the area is popular for cycling.

Kune Falls is 3.7 km from Regenta SGS Greenotel - Lonavala, while Bhushi Dam is 5.7 km from the property. The nearest airport is Pune International Airport, 70 km from the accommodation.

Couples particularly like the location — they rated it 8.2 for a two-person trip.","{""ac"": true, ""tv"": true, ""bar"": false, ""spa"": true, ""wifi"": true, ""laundry"": false, ""parking"": false, ""restaurant"": false, ""pet_friendly"": false, ""room_service"": false, ""swimming_pool"": true, ""fitness_center"": false}",4.8
8,The Orchid Lonavala,hotel/The_Orchid_Lonavala.jpg,Lonavala,"Swarajya , CTS 284 Old Mumbai-Pune Highway ,Valvan",https://www.google.com/maps/embed?pb=!1m18!1m12!1m3!1d3777.8816368438424!2d73.41448609999999!3d18.758823299999996!2m3!1f0!2f0!3f0!3m2!1i1024!2i768!4f13.1!3m3!1m2!1s0x3be801529d1172d5%3A0x88f041c83013c4af!2sThe%20Orchid%20Lonavala!5e0!3m2!1sen!2sin!4v1709820379084!5m2!1sen!2sin,"Set in Lonavala, 7 km from Bhushi Dam, The Orchid Lonavala offers accommodation with a restaurant, free private parking, an outdoor swimming pool and a bar. Among the facilities at this property are a concierge service and valet parking, along with free WiFi throughout the property. The accommodation features a 24-hour front desk, room service and currency exchange for guests.

At the hotel all rooms come with air conditioning and a flat-screen TV.

Continental and American breakfast options are available every morning at The Orchid Lonavala.

Lion's Point is 12 km from the accommodation, while Tiger Point is 13 km away. The nearest airport is Pune International Airport, 69 km from The Orchid Lonavala.

Couples particularly like the location — they rated it 8.6 for a two-person trip.","{""ac"": true, ""tv"": true, ""bar"": false, ""spa"": true, ""wifi"": true, ""laundry"": false, ""parking"": true, ""restaurant"": true, ""pet_friendly"": false, ""room_service"": false, ""swimming_pool"": false, ""fitness_center"": false}",4.8
7,Treebo Trend Five Elements,hotel/five_elements.jpg,Lonavala,"Behind Varsu Hotel, Old Mumbai, Pune Hwy, Varsoli, Lonavala",https://www.google.com/maps/embed?pb=!1m18!1m12!1m3!1d30223.18313725922!2d73.4360572!3d18.7580974!2m3!1f0!2f0!3f0!3m2!1i1024!2i768!4f13.1!3m3!1m2!1s0x3be8019c390c4fff%3A0x90978f693d8c5119!2sHotel%20Five%20Elements%20-%20Resort%20-%20Lonavala!5e0!3m2!1sen!2sin!4v1709820057827!5m2!1sen!2sin,"Treebo Trend Five Elements Lonavala is set in Lonavala, 3.8 km from Lonavala Railway Station and 6.9 km from Kune Falls. With a restaurant, the 3-star hotel has air-conditioned rooms with free WiFi, each with a private bathroom. The accommodation offers room service and a 24-hour front desk for guests.

All guest rooms come with a flat-screen TV with satellite channels, a kettle, a shower, free toiletries and a wardrobe. All rooms feature bed linen.

A vegetarian breakfast is available every morning at the hotel.

Bhushi Dam is 8.9 km from Treebo Trend Five Elements Lonavala, while Lion's Point is 14 km from the property. The nearest airport is Pune International Airport, 68 km from the accommodation.","{""ac"": true, ""tv"": true, ""bar"": false, ""spa"": false, ""wifi"": true, ""laundry"": false, ""parking"": true, ""restaurant"": false, ""pet_friendly"": false, ""room_service"": false, ""swimming_pool"": false, ""fitness_center"": false}",4.8
6,Courtyard by Marriott Mahabaleshwar,hotel/courtyard.jpg,Mahabaleshwar,"Metgutad, Panchgani-Mahabaleshwar Road",https://www.google.com/maps/embed?pb=!1m18!1m12!1m3!1d3796.165364059225!2d73.6930381!3d17.924439499999995!2m3!1f0!2f0!3f0!3m2!1i1024!2i768!4f13.1!3m3!1m2!1s0x3bc265363fcde551%3A0xdd1668dfcc89110!2sCourtyard%20by%20Marriott%20Mahabaleshwar!5e0!3m2!1sen!2sin!4v1709819603542!5m2!1sen!2sin,"Set in Mahabaleshwar, 70 metres from Lingmala Falls, Courtyard by Marriott Mahabaleshwar offers accommodation with free bikes, free private parking, an outdoor swimming pool and a fitness centre. This 5-star hotel offers a 24-hour front desk and a concierge service. There is a hot tub, evening entertainment and room service.

At the hotel, all rooms include a desk. The private bathroom is fitted with a shower, free toiletries and a hairdryer. All guest rooms feature bed linen.

Guests at Courtyard by Marriott Mahabaleshwar can enjoy a buffet breakfast. At the accommodation you will find a restaurant serving Chinese, Indian and Italian cuisine. Vegetarian, dairy-free and halal options can also be requested.

You can play table tennis at Courtyard by Marriott Mahabaleshwar, and car hire is available.

Mahabaleshwar Temple is 7.2 km from the hotel, while Venna Lake is 7.2 km from the property. The nearest airport is Pune International, 119 km from Courtyard by Marriott Mahabaleshwar, and the property offers a paid airport shuttle service.","{""ac"": true, ""tv"": false, ""bar"": false, ""spa"": false, ""wifi"": true, ""laundry"": false, ""parking"": false, ""restaurant"": true, ""pet_friendly"": false, ""room_service"": false, ""swimming_pool"": true, ""fitness_center"": true}",5.0
