rid,name,img,city,area,location,description,amenities,rating
5,Treebo Trend Nakshatra Cottages Mahabaleshwar,hotel/treebo.jpg,Mahabaleshwar,"Panchgani, near Mapro Ggarden",https://www.google.com/maps/embed?pb=!1m18!1m12!1m3!1d3796.190735903738!2d73.73725637490529!3d17.92325558714754!2m3!1f0!2f0!3f0!3m2!1i1024!2i768!4f13.1!3m3!1m2!1s0x3bc26596f29f079d%3A0x6c02c2fa86026f68!2sTreebo%20Trend%20Nakshatra%20Cottages!5e0!3m2!1sen!2sin!4v1709818911577!5m2!1sen!2sin,"Located within 4.9 km of Lingmala Falls and 5.6 km of Parsi Point, Treebo Trend Nakshatra Cottages Mahabaleshwar provides rooms with air conditioning and a private bathroom in Mahabaleshwar. This 3-star hotel offers room service, a 24-hour front desk and free WiFi. The hotel features family rooms.

At the hotel, each room has a balcony. Guest rooms in Treebo Trend Nakshatra Cottages Mahabaleshwar are equipped with a flat-screen TV and free toiletries.

Guests at the accommodation can enjoy a continental or a vegetarian breakfast.

Sydney Point is 10 km from Treebo Trend Nakshatra Cottages Mahabaleshwar, while Mahabaleshwar Temple is 12 km away. The nearest airport is Pune International Airport, 117 km from the hotel.

Distance in property description is calculated using © OpenStreetMap","{""ac"": true, ""tv"": true, ""bar"": false, ""spa"": false, ""wifi"": true, ""laundry"": true, ""parking"": false, ""restaurant"": true, ""pet_friendly"": true, ""room_service"": false, ""swimming_pool"": false, ""fitness_center"": false}",3.7
4,Hotel Shreyansh,hotel/hotel4.jpeg,Mahabaleshwar,MG Road,https://www.google.com/maps/embed?pb=!1m18!1m12!1m3!1d2429.12973885223!2d73.65475067684105!3d17.92566230948073!2m3!1f0!2f0!3f0!3m2!1i1024!2i768!4f13.1!3m3!1m2!1s0x3bc2654d7b55bbe9%3A0xe6a07f0ba293ac22!2sHotel%20Shreyas!5e1!3m2!1sen!2sin!4v1709817160226!5m2!1sen!2sin,"Hotel Shreyas:

Experience a blend of tradition and modernity at Hotel Shreyas, where timeless hospitality meets contemporary comfort. Nestled in the heart of the city, this renowned hotel welcomes guests with its gracious service and impeccable amenities. With its elegant decor and cozy accommodations, Hotel Shreyas provides a peaceful retreat for travelers seeking relaxation and convenience. Indulge in delectable cuisine at the hotel's restaurants, offering a delightful culinary journey for every palate. Whether you're here for business or leisure, Hotel Shreyas promises a memorable stay with its unmatched hospitality and attention to detail.","{""ac"": false, ""tv"": false, ""bar"": false, ""spa"": false, ""wifi"": false, ""laundry"": false, ""parking"": false, ""restaurant"": false, ""pet_friendly"": false, ""room_service"": false, ""swimming_pool"": false, ""fitness_center"": false}",4.2
3,Hotel Shree Paradise,img/hotel3.jpeg,Mahabaleshwar,MG Road,https://www.google.com/maps/embed?pb=!1m18!1m12!1m3!1d858.8256078535524!2d73.6542468447774!3d17.925960833467112!2m3!1f0!2f0!3f0!3m2!1i1024!2i768!4f13.1!3m3!1m2!1s0x3bc2654d5b99ea83%3A0xb83db0ac3660ce4!2sHotel%20Shree%20Paradise!5e1!3m2!1sen!2sin!4v1709817011246!5m2!1sen!2sin,"Discover a haven of comfort and hospitality at Hotel Shree Paradise. With its warm ambiance and attentive service, this hotel offers a welcoming retreat for travelers seeking a comfortable stay. From cozy rooms equipped with modern amenities to delectable dining options showcasing local flavors, Hotel Shree Paradise ensures a memorable experience for guests. Whether you're exploring the city's attractions or simply unwinding after a day of sightseeing, the hotel provides a convenient and relaxing environment for both leisure and business travelers alike.","{""ac"": true, ""tv"": true, ""bar"": false, ""spa"": false, ""wifi"": false, ""laundry"": true, ""parking"": false, ""restaurant"": true, ""pet_friendly"": true, ""room_service"": false, ""swimming_pool"": true, ""fitness_center"": false}",4.5
2,PARKYARD NATURE RESORT,img/hotel2.jpeg,Mahabaleshwar,Polo Ground,https://www.google.com/maps/embed?pb=!1m18!1m12!1m3!1d1444.3784574555189!2d73.6436241390023!3d17.924525134172054!2m3!1f0!2f0!3f0!3m2!1i1024!2i768!4f13.1!3m3!1m2!1s0x3bc27bbc47f09d4d%3A0xe74d91e3060202!2sPARKYARD%20NATURE%20RESORT!5e1!3m2!1sen!2sin!4v1709816938043!5m2!1sen!2sin,"Escape to PARKYARD NATURE RESORT, where tranquility meets adventure in a lush natural setting. Surrounded by verdant landscapes and abundant wildlife, this resort offers a sanctuary for nature enthusiasts and relaxation seekers alike. Immerse yourself in the peaceful ambiance of the resort's eco-friendly accommodations and unwind amidst the beauty of nature. Whether hiking through scenic trails, birdwatching in the surrounding forest, or simply lounging by the poolside, PARKYARD NATURE RESORT provides an idyllic retreat for guests seeking a harmonious blend of relaxation and outdoor adventure.","{""ac"": ""on"", ""tv"": ""on"", ""bar"": ""on"", ""spa"": ""on"", ""wifi"": false, ""laundry"": ""on"", ""parking"": ""on"", ""restaurant"": ""on"", ""pet_friendly"": ""on"", ""room_service"": ""on"", ""swimming_pool"": ""on"", ""fitness_center"": ""on""}",4.2
1,M.T.D.C. Mahabaleshwar,img/hotel1.jpeg,Mahabaleshwar,Polo Ground,https://www.google.com/maps/embed?pb=!1m18!1m12!1m3!1d2042.6859954674721!2d73.6420358400756!3d17.922236399356393!2m3!1f0!2f0!3f0!3m2!1i1024!2i768!4f13.1!3m3!1m2!1s0x3bc27b71ed3c3e1d%3A0xc31c1bf982782c55!2sM.T.D.C.%20Mahabaleshwar!5e1!3m2!1sen!2sin!4v1709816818336!5m2!1sen!2sin,"Nestled amidst serene landscapes, M.T.D.C. Mahabaleshwar offers a tranquil retreat for nature lovers and adventure seekers alike. With comfortable accommodations and modern amenities, guests can unwind and rejuvenate in the heart of nature. The hotel provides a perfect base for exploring the scenic beauty and cultural attractions of the surrounding area. Whether indulging in outdoor adventures or simply enjoying the breathtaking views, M.T.D.C. Mahabaleshwar promises an unforgettable experience for guests seeking relaxation and adventure.","{""ac"": false, ""tv"": true, ""bar"": false, ""spa"": true, ""wifi"": true, ""laundry"": true, ""parking"": true, ""restaurant"": false, ""pet_friendly"": true, ""room_service"": false, ""swimming_pool"": false, ""fitness_center"": false}",4.0
